date,description,amount,category
2021-08-17,Cooper-Garcia Diverse optimal array,348.56,Pets
2021-11-16,Dixon-Anderson Business-focused holistic initiative,435.24,Insurance
2022-02-01,Ellis Ltd Universal heuristic strategy,393.32,Food & Drink
2021-10-22,Williams-Glenn Team-oriented radical strategy,418.42,Entertainment
2021-09-27,"Baker, Anderson and Brady Secured 3rdgeneration workforce",193.4,Utilities
2021-12-28,"Miller, Mullins and Weber Organized composite parallelism",56.73,Entertainment
2021-10-26,"Pena, Velasquez and Martinez Self-enabling static help-desk",319.08,Health & Fitness
2021-10-06,Le PLC Profound needs-based hierarchy,411.34,Utilities
2022-01-24,Mcclure-Mercer Business-focused static benchmark,64.52,Pets
2021-09-03,Rojas-Berg Organic actuating open system,248.53,Travel
2021-12-28,Gould Ltd Function-based next generation Local Area Network,275.47,Personal Care
2022-01-25,Harrell PLC Customizable context-sensitive firmware,149.27,Groceries
2021-12-27,Hart Ltd Polarized dynamic contingency,168.7,Utilities
2022-02-23,"Cordova, Trujillo and Watson Open-architected hybrid intranet",412.8,Food & Drink
2021-11-14,"Hall, Martinez and Gomez Team-oriented explicit paradigm",478.18,Travel
2022-01-27,"Price, Mercer and Lee Cloned high-level challenge",479.54,Utilities
2021-10-12,Green-Thompson Open-architected explicit customer loyalty,325.62,Utilities
2021-10-09,Pierce-Koch Pre-emptive bandwidth-monitored database,388.12,Gifts & Donations
2022-02-18,Nelson and Sons Balanced contextually-based knowledgebase,435.03,Utilities
2021-12-31,Barker LLC Stand-alone full-range monitoring,348.37,Health & Fitness
2021-08-29,Gonzales Inc Distributed reciprocal encryption,444.8,Food & Drink
2021-09-05,Smith Group Reactive tangible knowledge user,305.39,Health & Fitness
2022-02-27,Berry-Byrd Automated maximized system engine,444.82,Personal Care
2021-09-20,Clark-Reilly Integrated content-based matrix,277.29,Entertainment
2021-12-16,Wallace-Gamble Team-oriented zero administration matrices,32.62,Personal Care
2021-08-23,"Gonzalez, Phillips and Adams Organized tangible initiative",438.69,Insurance
2021-12-11,Cooper Inc Profit-focused static encryption,266.74,Transportation
2022-01-19,"Brown, Bright and Rodriguez Public-key methodical projection",497.5,Health & Fitness
2021-09-26,Smith Ltd Intuitive hybrid solution,300.96,Education
2021-10-31,Torres LLC Fully-configurable real-time Graphic Interface,484.43,Rent
2021-09-01,Keller and Sons Managed contextually-based support,21.36,Transportation
2021-11-18,Hines Ltd Expanded client-driven protocol,43.37,Groceries
2021-09-29,Fry-Harris Business-focused client-driven hub,403.17,Travel
2022-01-14,Shea Group Secured 4thgeneration installation,222.28,Shopping
2021-09-08,Kerr Group Open-architected hybrid implementation,222.85,Home Improvement
2021-12-01,Thomas-Love Assimilated secondary hierarchy,447.77,Entertainment
2021-08-28,Conner-Martin Inverse logistical groupware,202.69,Gifts & Donations
2021-09-12,Fischer-Shaw Vision-oriented bandwidth-monitored interface,150.96,Pets
2021-09-23,Smith-Rivera Right-sized actuating website,234.27,Food & Drink
2021-12-18,Martin LLC Adaptive background groupware,470.32,Entertainment
2021-10-03,Newman Inc Multi-lateral global system engine,490.08,Travel
2021-12-12,"Chan, Ward and Phillips Polarized fresh-thinking model",231.97,Utilities
2021-11-29,Clark LLC Pre-emptive executive software,60.14,Utilities
2022-01-05,"Faulkner, Malone and Sherman Customer-focused impactful application",143.95,Insurance
2021-10-27,Moore PLC Universal impactful policy,406.95,Travel
2021-12-23,"Nelson, Richardson and Lewis Organized impactful architecture",131.79,Insurance
2021-11-21,Steele-Austin Self-enabling foreground algorithm,45.84,Pets
2021-09-27,Burns-Mcdonald Synergistic national orchestration,90.34,Food & Drink
